{
  "schemaVersion": 1,
  "identity": {
    "id": "81",
    "name": "Fixtures / Mock identity",
    "agentId": "fixture-input-agent",
    "generation": 2,
    "kind": "chatgpt"
  },
  "state": "authenticated",
  "authenticated": true,
  "checkedAt": "2026-10-18T00:00:00Z",
  "createdAt": "2026-10-18T00:00:00Z",
  "updatedAt": "2026-10-18T00:00:00Z",
  "cleanupPending": false
}
